{
  "schema_version": "0.2",
  "dataset_id": "BioASQ",
  "dataset_name": "BioASQ",
  "metadata": {
    "source_type": "challenge",
    "homepage": "https://www.bioasq.org",
    "repositories": [
      {
        "platform": "other",
        "url": "https://bioasq.org"
      }
    ],
    "summary": "BioASQ is an annual large-scale community challenge on biomedical semantic question answering over the biomedical literature. It releases a growing corpus of biomedical semantic resources and a set of tasks: large-scale online MEDLINE indexing, document retrieval, passage retrieval, snippet extraction, semantic/reading-comprehension question answering, and a novel biomedical semantic QA task that combines retrieval and generation. Training/development data are drawn from PubMed abstracts and full-text biomedical articles in English.",
    "access_method": "registration",
    "purpose": "To advance biomedical semantic question answering over the biomedical literature, emphasizing literature-based QA rather than clinical prediction.",
    "avoided_uses": "Clinical decision support or patient-level prediction; non-English biomedical QA.",
    "creators": [
      "National Centre for Scientific Research \"Demokritos\" and collaborators"
    ],
    "papers": [
      {
        "title": "BioASQ: A large biomedical semantic QA challenge",
        "url": "https://www.bioasq.org"
      }
    ]
  },
  "medical_fields": [
    "Imaging",
    "Internal Medicine",
    "Basic Medicine",
    "Clinical Medicine"
  ],
  "modality": {
    "modalities": [
      "text"
    ],
    "scope": "Biomedical literature (PubMed/PMC)",
    "data_format": [
      "XML",
      "JSON",
      "TSV"
    ]
  },
  "ethics": {
    "license": "CC BY-NC-SA 4.0",
    "commercial_use_allowed": false,
    "consent": "not-reported",
    "data_use_agreement": true,
    "privacy_measures": "Data consists of publicly available PubMed/PMC literature; no personal health information.",
    "legal_compliance": "Complies with PubMed/PMC reuse policies; CC BY-NC-SA 4.0 governs challenge data."
  },
  "extraction": {
    "method": "hybrid",
    "human_reviewed": false,
    "last_updated": "2026-08-19",
    "notes": "Baseline card derived solely from dataset_catalog.xlsx real metadata; remaining fields require paper/README or manual completion.",
    "pending_verification": [
      "The following LLM fields were auto-dropped for violating schema constraints and reverted to baseline; pending manual review: tasks_and_use/intended_tasks[list-items]"
    ]
  },
  "bias_and_limitations": {
    "known_limitations": [
      "Corpus changes annually; not static.",
      "QA is literature/retrieval-oriented rather than patient-level.",
      "English-only corpus.",
      "Requires registration for access."
    ],
    "representativeness_concerns": "Biased toward English-language, PubMed-indexed, peer-reviewed biomedical literature; underrepresents non-English, grey, or clinical-source literature.",
    "generalizability_statement": "Results may not generalize to non-English biomedical QA, clinical EHR-based QA, or domains outside PubMed/PMC coverage.",
    "missing_data": "No patient-level or clinical encounter data; no demographic or geographic metadata about article origins."
  },
  "tasks_and_use": {
    "intended_tasks": [
      "retrieval",
      "qa"
    ],
    "excluded_tasks": "Clinical prediction, patient-level diagnosis, multimodal reasoning"
  },
  "data_origin": {
    "origin_type": "research-derived",
    "selection_rationale": "Training/development data are drawn from PubMed abstracts and full-text biomedical articles in English.",
    "sampling_strategy": "Annual release of curated biomedical literature (PubMed/PMC) for QA tasks; corpus grows yearly."
  },
  "population": {
    "target_population": "Biomedical literature (PubMed abstracts and full-text articles in English)",
    "attribute_recording": {
      "method": "computed"
    }
  },
  "geography": {
    "regions": [
      "Global"
    ],
    "data_collection_setting": "multi-country",
    "collection_period": {
      "start": "2012-01-01"
    }
  },
  "annotation": {
    "annotation_type": "expert",
    "annotation_method": "Human experts construct questions and answers based on biomedical literature; some tasks involve NLP-assisted annotation (e.g., snippet extraction).",
    "annotators": {
      "type": "radiologist",
      "qualifications": "Biomedical domain experts and NLP researchers"
    },
    "labeling_provenance": "Questions and answers manually created by domain experts from PubMed/PMC content.",
    "known_label_noise": false,
    "annotation_guidelines_available": false
  }
}