{
  "schema_version": "0.2",
  "dataset_id": "eICU-CRD",
  "dataset_name": "eICU Collaborative Research Database",
  "metadata": {
    "source_type": "registry",
    "homepage": "https://physionet.org/content/eicu-crd/",
    "repositories": [
      {
        "platform": "PhysioNet",
        "url": "https://physionet.org/content/eicu-crd/"
      }
    ],
    "summary": "A multi-center intensive care unit database with records from 200,859 ICU admissions from 139,367 unique patients at 208 hospitals in the United States between 2014 and 2015. Includes vital signs, care plan documentation, medications, laboratory measurements, and severity of illness scores.",
    "persistent_identifier": "10.1038/sdata.2018.178",
    "version": "2018",
    "access_method": "credentialed",
    "custodian": "PhysioNet",
    "purpose": "To support collaborative multi-center research, external validation, and federated learning of clinical models.",
    "avoided_uses": "Commercial use.",
    "creators": [
      "Pollard, T.J.",
      "Johnson, A.E.W.",
      "Raffa, J.D.",
      "Celi, L.A.",
      "Mark, R.G.",
      "Badawi, O."
    ],
    "papers": [
      {
        "title": "eICU Collaborative Research Database, a freely available multi-center database for critical care research",
        "url": "https://www.nature.com/articles/sdata2018178",
        "year": 2018,
        "doi": "10.1038/sdata.2018.178"
      }
    ]
  },
  "medical_fields": [
    "Clinical Medicine"
  ],
  "modality": {
    "modalities": [
      "EHR"
    ],
    "sample_counts": {
      "patients": 139367,
      "studies": 200859
    },
    "scope": "Intensive care unit clinical data",
    "data_format": [
      "CSV"
    ]
  },
  "ethics": {
    "license": "PhysioNet Credentialed Data Use Agreement",
    "commercial_use_allowed": false,
    "consent": "waived",
    "data_use_agreement": true,
    "privacy_measures": "De-identification performed per HIPAA Safe Harbor method; no protected health information retained.",
    "legal_compliance": "Compliant with HIPAA de-identification standards."
  },
  "extraction": {
    "method": "hybrid",
    "human_reviewed": false,
    "last_updated": "2026-08-18",
    "notes": "Baseline card derived solely from dataset_catalog.xlsx real metadata; remaining fields require paper/README or manual completion.",
    "pending_verification": [
      "The following LLM fields were auto-dropped for violating schema constraints and reverted to baseline; pending manual review: medical_fields[list-items]"
    ]
  },
  "bias_and_limitations": {
    "known_limitations": [
      "Limited to US hospitals (208 centers), potentially limiting generalizability to non-US or resource-limited settings.",
      "Data restricted to 2014–2015; may not reflect current practices, technologies, or disease patterns.",
      "No explicit reporting on demographic representation (race, ethnicity, sex, age distribution).",
      "Potential selection bias due to voluntary hospital participation and exclusion of non-participating ICUs."
    ],
    "modifications": "Data de-identified and harmonized; no synthetic data generation reported.",
    "bias_sources": [
      "sampling",
      "geographic",
      "temporal",
      "missing demographic attributes"
    ],
    "representativeness_concerns": "US-only, 2014–2015, 208 participating hospitals — may not represent global or evolving ICU practice.",
    "generalizability_statement": "Designed for multi-center generalization and external validation within similar US academic/community ICU settings; limited generalizability outside this domain and timeframe.",
    "subgroup_coverage": "No subgroup coverage statistics provided in source text.",
    "missing_data": "Missingness patterns not quantified in abstract; known to exist in EHR-derived fields (e.g., labs, vitals)."
  },
  "data_origin": {
    "origin_type": "clinical-care",
    "selection_rationale": "Records selected from de-identified ICU admissions across participating US hospitals to enable multi-center critical care research.",
    "sampling_strategy": "Consecutive ICU admissions from 208 US hospitals during 2014–2015; no explicit sampling strategy beyond temporal and institutional inclusion.",
    "aggregation_multisource": "Aggregated from 208 US hospitals; data harmonized and curated for consistency.",
    "data_shifts_overtime": "Data collected only from 2014–2015; no longitudinal or multi-version shift analysis reported."
  },
  "population": {
    "target_population": "Adult and pediatric ICU patients in the United States.",
    "sex": "not-reported",
    "inclusion_criteria": "ICU admission at a participating hospital during 2014–2015.",
    "vulnerable_groups": [
      "critical-care"
    ],
    "missing_groups": "No explicit reporting on underrepresented groups (e.g., race/ethnicity, age subgroups, rural vs. urban); abstract states 'no explicit demographic subgroup statistics'.",
    "attribute_recording": {
      "method": "unknown"
    }
  },
  "geography": {
    "countries": [
      "United States"
    ],
    "regions": [
      "North America"
    ],
    "data_collection_setting": "multi-center",
    "collection_period": {
      "start": "2014-01-01",
      "end": "2015-12-31"
    },
    "institution_count": 208
  },
  "annotation": {
    "annotation_type": "automatic",
    "annotation_method": "Derived from structured EHR fields (e.g., ICD-9 codes, lab results, vitals, nursing notes).",
    "labeling_provenance": "Labels extracted from clinical documentation and coded data within the EHR system."
  },
  "tasks_and_use": {
    "intended_tasks": [
      "classification"
    ],
    "benchmarks": [
      "eICU benchmark tasks (e.g., mortality prediction, length-of-stay estimation)"
    ],
    "excluded_tasks": "Commercial applications; real-time clinical decision support without further validation."
  }
}