{
  "schema_version": "0.2",
  "dataset_id": "MIMIC-IV",
  "dataset_name": "MIMIC-IV",
  "metadata": {
    "source_type": "registry",
    "homepage": "https://mimic.mit.edu/",
    "repositories": [
      {
        "platform": "PhysioNet",
        "url": "https://physionet.org/content/mimiciv/2.2/"
      }
    ],
    "summary": "MIMIC-IV is a large, freely available database comprising de-identified health-related data associated with over two hundred thousand patients who were admitted to the critical care units and the hospital of the Beth Israel Deaconess Medical Center in Boston, Massachusetts, USA, between 2008 and 2022. The database includes demographics, vital signs, laboratory tests, medications, observations, and notes.",
    "persistent_identifier": "10.1038/s41597-022-01899-x",
    "version": "2.2",
    "access_method": "credentialed",
    "custodian": "Beth Israel Deaconess Medical Center",
    "purpose": "To support a wide range of research including early warning systems, risk prediction, causal inference, and interpretability of clinical machine learning models.",
    "creators": [
      "Johnson, A.E.W.",
      "Bulgarelli, L.",
      "Shen, L.",
      "Gayles, A.",
      "Shammout, A.",
      "Horng, S.",
      "Pollard, T.J.",
      "Hao, S.",
      "Moody, B.",
      "Gow, B.",
      "Lehman, L.H.",
      "Celi, L.A.",
      "Mark, R.G."
    ],
    "funders": [
      "National Institute of Biomedical Imaging and Bioengineering (NIBIB)",
      "National Institute of General Medical Sciences (NIGMS)"
    ],
    "papers": [
      {
        "title": "MIMIC-IV, a freely accessible electronic health record dataset",
        "url": "https://www.nature.com/articles/s41597-022-01899-x",
        "year": 2023,
        "doi": "10.1038/s41597-022-01899-x"
      }
    ]
  },
  "medical_fields": [
    "Clinical Medicine"
  ],
  "modality": {
    "modalities": [
      "EHR"
    ],
    "scope": "Hospital and ICU admissions, including demographics, vital signs, labs, medications, notes.",
    "data_format": [
      "CSV"
    ],
    "sample_counts": {
      "patients": 299712,
      "studies": 431231,
      "samples": 73181
    }
  },
  "ethics": {
    "license": "PhysioNet Credentialed Data Use Agreement",
    "commercial_use_allowed": false,
    "consent": "waived",
    "irb_approval": true,
    "data_use_agreement": true,
    "privacy_measures": "De-identification performed per HIPAA Safe Harbor guidelines; protected health information removed or generalized.",
    "legal_compliance": "Compliant with HIPAA and MIT Institutional Review Board requirements."
  },
  "extraction": {
    "method": "hybrid",
    "human_reviewed": false,
    "last_updated": "2026-08-18",
    "notes": "Baseline card derived solely from dataset_catalog.xlsx real metadata; remaining fields require paper/README or manual completion.",
    "pending_verification": [
      "geography.countries is heuristically inferred from limitation text; requires manual verification",
      "The following LLM fields were auto-dropped for violating schema constraints and reverted to baseline; pending manual review: medical_fields[list-items]"
    ]
  },
  "geography": {
    "countries": [
      "United States"
    ],
    "regions": [
      "North America"
    ],
    "data_collection_setting": "single-center",
    "collection_period": {
      "start": "2008-01-01",
      "end": "2022-12-31"
    },
    "institution_count": 1
  },
  "bias_and_limitations": {
    "known_limitations": [
      "Single-center origin limits geographic and institutional diversity.",
      "Temporal shifts in coding, practice, and EHR systems may affect longitudinal consistency.",
      "Demographic subgroup distributions (age, sex, ethnicity) not reported in source text.",
      "Potential selection bias: only patients admitted to a tertiary academic medical center."
    ],
    "modifications": "De-identification applied; no synthetic data generation reported.",
    "bias_sources": [
      "sampling",
      "geographic",
      "temporal",
      "clinical-setting"
    ],
    "representativeness_concerns": "Not representative of global or even broader US populations; reflects one academic medical center.",
    "long_tail_classes": "Not specified in source text.",
    "generalizability_statement": "Results may not generalize beyond similar high-resource, academic, urban US hospitals.",
    "subgroup_coverage": "No explicit reporting of subgroup coverage (e.g., race, gender, age bands).",
    "missing_data": "EHR data inherently contains missingness due to clinical workflow variability; extent not quantified in abstract."
  },
  "tasks_and_use": {
    "intended_tasks": [
      "classification",
      "causal"
    ],
    "benchmarks": [
      "MIMIC-IV Benchmark (e.g., mortality prediction, sepsis detection)"
    ],
    "excluded_tasks": "Commercial deployment or direct clinical decision support without validation."
  },
  "data_origin": {
    "origin_type": "clinical-care",
    "selection_rationale": "Patients admitted to the critical care units and the hospital of the Beth Israel Deaconess Medical Center.",
    "sampling_strategy": "Consecutive admissions at a single academic medical center; no explicit random or stratified sampling described.",
    "aggregation_multisource": "Data aggregated from multiple hospital information systems (EHR modules), but sourced from a single institution.",
    "data_shifts_overtime": "Data collected across 2008–2022; known temporal shifts in clinical practice, coding standards (e.g., ICD-9 to ICD-10), and EHR software versions are expected but not quantified in source text."
  },
  "population": {
    "target_population": "Adult and pediatric patients admitted to hospital and ICU at Beth Israel Deaconess Medical Center.",
    "age_reported": false,
    "sex": "not-reported",
    "ethnicity_reported": false,
    "inclusion_criteria": "Hospital admission at Beth Israel Deaconess Medical Center.",
    "exclusion_criteria": "None explicitly stated in abstract.",
    "vulnerable_groups": [
      "critical-care",
      "pediatric",
      "elderly"
    ],
    "missing_groups": "No explicit statement on underrepresented groups; limited generalizability beyond single US academic medical center.",
    "attribute_recording": {
      "method": "computed",
      "unknown_proportion": "Proportion of unknown/missing demographic values not reported in source text."
    }
  },
  "annotation": {
    "annotation_type": "automatic",
    "annotation_method": "Derived from structured and unstructured EHR fields (e.g., ICD codes, lab results, clinician notes).",
    "annotators": {
      "type": "clinician",
      "qualifications": "Clinicians and coders at Beth Israel Deaconess Medical Center."
    },
    "labeling_provenance": "Labels derived from clinical documentation and billing codes; subject to real-world EHR noise and incompleteness.",
    "known_label_noise": true,
    "label_noise_description": "Inherent noise due to documentation practices, coding delays, and incomplete data entry in clinical settings.",
    "annotation_guidelines_available": false
  }
}