{
  "schema_version": "0.2",
  "dataset_id": "MedQA",
  "dataset_name": "MedQA",
  "metadata": {
    "source_type": "repository",
    "homepage": "https://huggingface.co/datasets/medqa",
    "repositories": [
      {
        "platform": "HuggingFace",
        "url": "https://huggingface.co/datasets/medqa"
      },
      {
        "platform": "GitHub",
        "url": "https://github.com/jind11/MedQA"
      }
    ],
    "summary": "A large-scale dataset for benchmarking medical question answering, sourced from professional medical board exam questions (USMLE-style), containing 12,723 question-answer pairs with explanations, covering multiple medical specialties and requiring multi-step clinical reasoning; includes a test split of 1,273 questions.",
    "access_method": "open",
    "purpose": "To advance research on medical knowledge question answering systems.",
    "creators": [
      "Jin, D.",
      "Pan, E.",
      "Oufattole, N.",
      "Weng, W.H.",
      "Fang, H.",
      "Szolovits, P."
    ]
  },
  "medical_fields": [
    "Clinical Medicine",
    "Internal Medicine",
    "Surgery",
    "Obstetrics & Gynecology"
  ],
  "modality": {
    "modalities": [
      "text"
    ],
    "scope": "Multiple medical specialties (e.g., internal medicine, pediatrics, surgery, obstetrics/gynecology, psychiatry)",
    "data_format": [
      "JSON",
      "CSV"
    ],
    "sample_counts": {
      "samples": 12723
    }
  },
  "ethics": {
    "license": "CC BY 4.0",
    "commercial_use_allowed": true,
    "consent": "not-reported",
    "data_use_agreement": false
  },
  "extraction": {
    "method": "hybrid",
    "human_reviewed": false,
    "last_updated": "2026-08-18",
    "notes": "Baseline card derived solely from dataset_catalog.xlsx real metadata; remaining fields require paper/README or manual completion.",
    "pending_verification": [
      "The following LLM fields were auto-dropped for violating schema constraints and reverted to baseline; pending manual review: medical_fields[list-items]"
    ]
  },
  "bias_and_limitations": {
    "known_limitations": [
      "Source limited to USMLE-style exams, reflecting U.S.-centric medical education and practice norms",
      "Lacks real-world clinical context (e.g., patient history, imaging, labs)",
      "No demographic or socioeconomic attributes reported for examinees or question authors",
      "Potential bias toward high-resource, English-dominant medical training environments"
    ],
    "representativeness_concerns": "USMLE-focused content may not represent global medical curricula, practice guidelines, or patient populations.",
    "subgroup_coverage": "No subgroup demographic data available; no reporting on representation across gender, ethnicity, or geographic origin of question authors or examinees."
  },
  "tasks_and_use": {
    "intended_tasks": [
      "qa"
    ]
  },
  "data_origin": {
    "origin_type": "clinical-trial"
  },
  "population": {
    "target_population": "Candidates taking USMLE-style medical licensing examinations in the United States",
    "missing_groups": "Non-US examinees; non-English-speaking populations; individuals outside formal medical training pathways"
  },
  "geography": {
    "countries": [
      "United States"
    ],
    "regions": [
      "North America"
    ],
    "data_collection_setting": "registry"
  },
  "annotation": {
    "annotation_type": "expert",
    "labeling_provenance": "Questions and answers sourced directly from USMLE-style board exam materials; explanations provided by domain experts or derived from official answer keys.",
    "known_label_noise": false
  }
}